{"$defs":{"ChannelPresentation":{"additionalProperties":false,"properties":{"channel_class":{"maxLength":192,"minLength":1,"pattern":"^[A-Za-z0-9][A-Za-z0-9:._/@+\\-=]*$","title":"Channel Class","type":"string"},"concise_by_default":{"title":"Concise By Default","type":"boolean"},"greeting":{"anyOf":[{"maxLength":512,"minLength":1,"type":"string"},{"type":"null"}],"title":"Greeting"},"signoff":{"anyOf":[{"maxLength":512,"minLength":1,"type":"string"},{"type":"null"}],"title":"Signoff"}},"required":["channel_class","greeting","signoff","concise_by_default"],"title":"ChannelPresentation","type":"object"},"VoiceStyle":{"additionalProperties":false,"properties":{"forbidden_wording":{"items":{"maxLength":512,"minLength":1,"type":"string"},"maxItems":32,"title":"Forbidden Wording","type":"array"},"maximum_paragraphs":{"maximum":12,"minimum":1,"title":"Maximum Paragraphs","type":"integer"},"name":{"maxLength":512,"minLength":1,"title":"Name","type":"string"},"preferred_wording":{"items":{"maxLength":512,"minLength":1,"type":"string"},"maxItems":32,"title":"Preferred Wording","type":"array"},"qualities":{"items":{"maxLength":512,"minLength":1,"type":"string"},"maxItems":16,"minItems":1,"title":"Qualities","type":"array"}},"required":["name","qualities","preferred_wording","forbidden_wording","maximum_paragraphs"],"title":"VoiceStyle","type":"object"}},"$id":"https://schemas.eva.local/contracts/IdentityPack-v1.schema.json","$schema":"https://json-schema.org/draft/2020-12/schema","additionalProperties":false,"properties":{"channel_presentations":{"items":{"$ref":"#/$defs/ChannelPresentation"},"maxItems":16,"minItems":1,"title":"Channel Presentations","type":"array"},"consent_preferences":{"items":{"maxLength":512,"minLength":1,"type":"string"},"maxItems":32,"title":"Consent Preferences","type":"array"},"contract":{"const":"IdentityPack/v1","title":"Contract","type":"string"},"conversation_boundaries":{"items":{"maxLength":512,"minLength":1,"type":"string"},"maxItems":32,"minItems":1,"title":"Conversation Boundaries","type":"array"},"display_name":{"maxLength":512,"minLength":1,"title":"Display Name","type":"string"},"humour":{"maxLength":512,"minLength":1,"title":"Humour","type":"string"},"identity_id":{"maxLength":192,"minLength":1,"pattern":"^[A-Za-z0-9][A-Za-z0-9:._/@+\\-=]*$","title":"Identity Id","type":"string"},"initiative_preferences":{"items":{"maxLength":512,"minLength":1,"type":"string"},"maxItems":32,"title":"Initiative Preferences","type":"array"},"issued_at":{"maxLength":20,"minLength":20,"pattern":"^[0-9]{4}-[0-9]{2}-[0-9]{2}T[0-9]{2}:[0-9]{2}:[0-9]{2}Z$","title":"Issued At","type":"string"},"issuer":{"maxLength":192,"minLength":1,"pattern":"^[A-Za-z0-9][A-Za-z0-9:._/@+\\-=]*$","title":"Issuer","type":"string"},"language":{"maxLength":35,"minLength":2,"pattern":"^[A-Za-z]{2,8}(?:-[A-Za-z0-9]{1,8})*$","title":"Language","type":"string"},"pack_version":{"maximum":2147483647,"minimum":1,"title":"Pack Version","type":"integer"},"privacy_preferences":{"items":{"maxLength":512,"minLength":1,"type":"string"},"maxItems":32,"title":"Privacy Preferences","type":"array"},"pronouns":{"items":{"maxLength":64,"minLength":1,"type":"string"},"maxItems":8,"minItems":1,"title":"Pronouns","type":"array"},"schema_version":{"const":1,"title":"Schema Version","type":"integer"},"signature":{"maxLength":88,"minLength":86,"pattern":"^[A-Za-z0-9_-]+={0,2}$","title":"Signature","type":"string"},"signature_algorithm":{"const":"Ed25519","title":"Signature Algorithm","type":"string"},"source_sha256":{"pattern":"^[0-9a-f]{64}$","title":"Source Sha256","type":"string"},"state":{"enum":["staged","current","superseded","revoked"],"title":"State","type":"string"},"temperament":{"items":{"maxLength":512,"minLength":1,"type":"string"},"maxItems":16,"minItems":1,"title":"Temperament","type":"array"},"unknown_relation_preferences":{"items":{"maxLength":512,"minLength":1,"type":"string"},"maxItems":16,"title":"Unknown Relation Preferences","type":"array"},"values":{"items":{"maxLength":512,"minLength":1,"type":"string"},"maxItems":32,"minItems":1,"title":"Values","type":"array"},"voice_style":{"$ref":"#/$defs/VoiceStyle"}},"required":["schema_version","contract","identity_id","pack_version","state","display_name","pronouns","language","voice_style","values","temperament","humour","conversation_boundaries","channel_presentations","privacy_preferences","consent_preferences","initiative_preferences","unknown_relation_preferences","issuer","source_sha256","signature_algorithm","signature","issued_at"],"title":"IdentityPack","type":"object"}
